{
  "id": "WG-MEMORY-0001",
  "key": "governance.example",
  "content": "只有經 Boss 或 QA review 的記憶才能進入 ACTIVE。",
  "contentHash": "cec4f347391988e4ff7eca06486464fe0a1e17d479f1ec19a6794ca60b6486da",
  "source": "workers-group-template",
  "memoryType": "SEMANTIC",
  "status": "CANDIDATE",
  "createdAt": "2026-07-30T00:00:00+00:00"
}
